{
  "schemaVersion": "gameplay-mechanism-candidate-v1",
  "mechanismCandidateId": "GMC-P1-CAPITAL-FRAMING",
  "requirementIds": [
    "REQ-P1-CAPITAL-FRAMING"
  ],
  "sourceSceneIds": [
    "DM1566-C02-REPORT-ARRIVES-YAN-HOUSE",
    "DM1566-C02-REPORT-AUDIENCE-FRAMING",
    "DM1566-C02-REPORT-SUPPRESSION-RISK",
    "DM1566-C04-REPORT-AND-LETTER-REACH-YAN",
    "DM1566-C23-URGENT-DISPATCH-AT-GATE"
  ],
  "sourceClaimIds": [
    "DM1566-C02-CL-REPORT-REACHES-YAN-HOUSE",
    "DM1566-C02-CL-REPORT-CHANNEL-INTERPRETED-POLITICALLY",
    "DM1566-C02-CL-REPORT-FRAMING-AT-AUDIENCE",
    "DM1566-C02-CL-REPORT-CAN-BE-SUPPRESSED",
    "DM1566-C04-CL-REPORT-AND-LETTER-REACH-YAN",
    "DM1566-C04-CL-REPORT-PROVOKES-IMMEDIATE-REACTION",
    "DM1566-C23-CL-ESCORT-EXPLAINS-DISPATCH-PROVENANCE",
    "DM1566-C23-CL-SHI-ORDERS-PERSONAL-DELIVERY-TO-CHEN"
  ],
  "candidateType": "CAUSAL_RULE",
  "dramaticFunction": "首报会改变京师收到的第一版事实而不预定最终裁决",
  "preconditions": [
    "正式或非正式文书已经进入递送渠道",
    "渠道中介、署名和附件状态可追踪"
  ],
  "actorRefs": [
    "actor.zhejiang_governor",
    "actor.zhejiang_xunfu",
    "institution.grand_secretariat",
    "institution.sili"
  ],
  "authorityOrResourceRefs": [
    "resource.official_document_channel",
    "institution.zhejiang_governor_yamen"
  ],
  "allowedMoves": [
    "走通政司正式渠道",
    "使用密奏或专递",
    "让多份文书相互印证",
    "在奏报中标明事实与推断边界"
  ],
  "likelyCountermoves": [
    "中介截留或延迟",
    "以另一套语言重述地方问题",
    "先见某一方奏报",
    "要求补证后再定性"
  ],
  "immediateStateEffects": [
    "report.dispatchStatus",
    "report.firstNarrativeController",
    "pendingConsequences"
  ],
  "delayedConsequences": [
    "京师先收到的版本形成第一版事实框架",
    "渠道记录成为后续追责的一部分"
  ],
  "invariantsToPreserve": [
    "京师角色不得提前知道未送达信息",
    "第一版定性不是最终御前裁决"
  ],
  "evidenceStrength": "EXPLICIT",
  "limitations": [
    "只定义渠道和政治解释机制",
    "不得提前引入第四部分裁决"
  ],
  "proposedAdaptationGapId": null,
  "status": "APPROVED_FOR_T3"
}
